{
  "$schema": "https://json-schema.org/draft/2020-12/schema",
  "$id": "LegendTacticsSettings.json",
  "title": "LegendTacticsSettings",
  "type": "array",
  "items": {
    "type": "object",
    "properties": {
      "Id": {
        "type": "integer",
        "minimum": 10101,
        "maximum": 10604
      },
      "Type": {
        "type": "integer",
        "minimum": 1,
        "maximum": 34
      },
      "Effect": {
        "type": "integer",
        "minimum": 0,
        "maximum": 50,
        "enum": [
          0,
          1,
          2,
          3,
          4,
          5,
          6,
          10,
          15,
          20,
          30,
          50
        ]
      },
      "SecondEffect": {
        "type": "integer",
        "minimum": 0,
        "maximum": 1651,
        "enum": [
          0,
          58,
          1581,
          1601,
          1651
        ]
      },
      "Distance": {
        "type": "integer",
        "minimum": 0,
        "maximum": 3,
        "enum": [
          0,
          1,
          2,
          3
        ]
      },
      "LimitedArmyType": {
        "type": "integer",
        "minimum": 0,
        "maximum": 101,
        "enum": [
          0,
          1,
          2,
          3,
          101
        ]
      },
      "SynergyArmyType": {
        "type": "integer",
        "minimum": 0,
        "maximum": 102,
        "enum": [
          0,
          1,
          102
        ]
      }
    },
    "required": [
      "Id",
      "Type",
      "Effect",
      "SecondEffect",
      "Distance",
      "LimitedArmyType",
      "SynergyArmyType"
    ],
    "additionalProperties": false
  }
}
